### ISSUE TITLE
RDP on Custom Port

### ISSUE THREAD

**Issue by skydive31** [FreeRDP/Remmina#1465]
Hi guys, no longer able to connect to custom ports.
Happened after the update from 1.0.0. to 1.2.0.
Nothing fixes it, tried all settings.
Anyone has the 1.0.0 rpm file for downgrading?

* Client (OS name and version): **Fedora 27 x86_64    4.14.16-300**
* Remmina version (remmina --version): **1.2.0-rcgit-26**
* Desktop environment (GNOME, Unity, KDE, ..): **GNOME 3.26.2**
* Connecting to (OS and version): **Windows Server 2008 R2 Datacenter SP1**
* Connecting via (RDP, VNC, ...):  **RDP**
* RDP issues only, freerdp version (xfreerdp --version): **2.0.0-dev2**

**Comment by giox069** [comment]
It should work: I currently use RDP on custom port without problems. Just add ":port" after the server name. Three checks to do:

1. Reboot your PC, If you did not after the upgrade.
2. Edit the connection profile, and check that SSH tunnel is not enabled.
3. Exit remmina, execute remmina from a terminal, connect and look at the output in the terminal. Copy and paste here.

**Comment by skydive31** [comment]
didn't work, usual error saying connection impossible.


StatusNotifier/Appindicator support: not supported by desktop. libappindicator will try to fallback to GtkStatusIcon/xembed
Running under Gnome Shell version 3.26.2
Gtk-Message: GtkDialog mapped without a transient parent. This is discouraged.
[17:19:31:090] [4263:4267] [INFO][com.freerdp.client.common.cmdline] - loading channelEx cliprdr
[17:19:31:090] [4263:4267] [INFO][com.freerdp.client.common.cmdline] - loading channelEx drdynvc
[17:19:46:097] [4263:4267] [ERROR][com.freerdp.core] - failed to connect to 52.17.18.88
[17:19:46:097] [4263:4267] [ERROR][com.freerdp.core.nego] - Protocol Security Negotiation Failure
[17:19:46:097] [4263:4267] [ERROR][com.freerdp.core] - freerdp_set_last_error ERRCONNECT_SECURITY_NEGO_CONNECT_FAILED [0x0002000C]
[17:19:46:097] [4263:4267] [ERROR][com.freerdp.core.connection] - Error: protocol security negotiation or connection failure
Gtk-Message: GtkDialog mapped without a transient parent. This is discouraged.

**Comment by giox069** [comment]
ERRCONNECT_SECURITY_NEGO_CONNECT_FAILED also appears when there is no answer from the other side.
Try to sniff traffic with tcpdump: install tcpdump package, open another shell window and type
```tcpdump -n host _the_remote_server_ip_address_``` (put the remote server IP address here, without the port). Connect to remmina. You should see some tcpdump lines like these:
```
17:24:34.994651 IP 192.168.56.3.59224 > XX.XX.XX.XX:port: Flags [S], seq 873003252, win 29200, options [mss 1460,sackOK,TS val 4058086829 ecr 0,nop,wscale 10], length 0
```
look at the port parameter after XX.XX.XX.XX and let us know.
Close tcpdump with CTRL+C.

**Comment by giox069** [comment]
Also check on the profile settings, under "Advanced" tab, the Security setting. Change it to Negotiate or other settings and see if it works.

**Comment by skydive31** [comment]
Advanced tab Negotiate did not change anything.
Dump with Negotiate below:
tcpdump: verbose output suppressed, use -v or -vv for full protocol decode
listening on wlp3s0, link-type EN10MB (Ethernet), capture size 262144 bytes
15:56:03.948202 IP 192.168.3.140.44630 > 52.17.18.88.nerv: Flags [S], seq 1700787342, win 29200, options [mss 1460,sackOK,TS val 3276044879 ecr 0,nop,wscale 7], length 0
15:56:05.001954 IP 192.168.3.140.44630 > 52.17.18.88.nerv: Flags [S], seq 1700787342, win 29200, options [mss 1460,sackOK,TS val 3276045933 ecr 0,nop,wscale 7], length 0
15:56:07.050013 IP 192.168.3.140.44630 > 52.17.18.88.nerv: Flags [S], seq 1700787342, win 29200, options [mss 1460,sackOK,TS val 3276047981 ecr 0,nop,wscale 7], length 0
15:56:11.082010 IP 192.168.3.140.44630 > 52.17.18.88.nerv: Flags [S], seq 1700787342, win 29200, options [mss 1460,sackOK,TS val 3276052013 ecr 0,nop,wscale 7], length 0

Dump with RDP enabled below:
15:57:51.503515 IP 192.168.3.140.44640 > 52.17.18.88.nerv: Flags [S], seq 1966421501, win 29200, options [mss 1460,sackOK,TS val 3276152435 ecr 0,nop,wscale 7], length 0
15:57:52.522021 IP 192.168.3.140.44640 > 52.17.18.88.nerv: Flags [S], seq 1966421501, win 29200, options [mss 1460,sackOK,TS val 3276153454 ecr 0,nop,wscale 7], length 0
15:57:54.570024 IP 192.168.3.140.44640 > 52.17.18.88.nerv: Flags [S], seq 1966421501, win 29200, options [mss 1460,sackOK,TS val 3276155502 ecr 0,nop,wscale 7], length 0
15:57:58.602006 IP 192.168.3.140.44640 > 52.17.18.88.nerv: Flags [S], seq 1966421501, win 29200, options [mss 1460,sackOK,TS val 3276159534 ecr 0,nop,wscale 7], length 0

**Comment by skydive31** [comment]
By the way, when using Windows to connect to RDP, no problems, 15 workstations connected simutaneously without issues. All was fine for me through Fedora until the update to 1.2.0.

**Comment by giox069** [comment]
It seems you are connecting on port "nerv" (1222) is it correct? Try to add "-n" twice to tcpdump and the port should appear as a number.
No one is answering to you: there is no traffic coming back from  52.17.18.88. I think you have a firewall somewhere that is blocking traffic to 52.17.18.88:1222 or from 52.17.18.88:1222 because tcpdump is not showing any kind of return traffic.
Check all your firewalls you have on the path from your PC to the server (usually there can be at least 4 firewalls: the one on your PC, your gateway, one at the remote site, and the windows firewall).

**Comment by skydive31** [comment]
I simply deleted the profile, created a new one, now it works with exactly the same settings.
Go figure....
Thanks a lot for your help and time.
